results_table.csv

,Accuracy,AUC,Precision,Recall,F1 Score,MCC
Logistic Regression,0.7275064267352185,0.9379405478716742,0.7612622504383219,0.7305280431533564,0.7417891382899583,0.6486798257059551
Decision Tree,0.7429305912596401,0.8533959257949361,0.7531384173844574,0.7558512469383396,0.7530279129042964,0.6687687006475068
KNN,0.7275064267352185,0.918371309683569,0.7458428900690327,0.7482091680713233,0.7415733635236575,0.6547987061932771
Naive Bayes,0.4524421593830334,0.8386476540381115,0.4315445362111632,0.4795442600423804,0.3829573119658799,0.37889970125548783
SVM,0.7506426735218509,0.9492793191333943,0.8006212672507854,0.7389512557432356,0.7626029076813045,0.6765358079899703

README.md

- SVM achieved the highest accuracy (75.06%), AUC (0.9493), precision (0.8006), F1 score (0.7626) and MCC (0.6765).
- Decision Tree achieved the highest recall (0.7559).
- Logistic Regression and KNN demonstrated competitive performance.
- Gaussian Naive Bayes showed comparatively lower performance.
- The dataset exhibits class imbalance, which can influence classification performance across different fault categories.